{
  "id": "example:record",
  "recordType": "Plugin.Installation",
  "schemaVersion": 1,
  "createdAt": "2026-10-01T07:10:00.000Z",
  "updatedAt": "2026-10-01T07:10:00.000Z",
  "ownerId": "local:owner",
  "packageId": "example",
  "revisionDigest": "aaaaaaaaaaaaaaaaaaaaaaaaaaaaaaaaaaaaaaaaaaaaaaaaaaaaaaaaaaaaaaaa",
  "desiredState": "enabled",
  "effectiveState": "staged",
  "registeredOperations": []
}